{
  "name": "jubi",
  "mode": "dark",
  "accent": {
    "name": "amber",
    "hex": "#E5C07B"
  },
  "wezterm": {
    "scheme": "jubi"
  },
  "nvim": {
    "background": "dark",
    "colorscheme": "jubi"
  },
  "sketchybar": {
    "profile": "jubi"
  },
  "vscode": {
    "theme": "Jubi"
  },
  "cursor": {
    "theme": "Jubi"
  },
  "wallpaper": "jubi-night.jpg"
}
