{
  "name": "sakura",
  "mode": "light",
  "accent": {
    "name": "pink",
    "hex": "#F28AB2"
  },
  "wezterm": {
    "scheme": "Sakura"
  },
  "nvim": {
    "background": "light",
    "colorscheme": "sakura"
  },
  "sketchybar": {
    "profile": "Sakura Light"
  },
  "vscode": {
    "theme": "Cherry Blossom Warm"
  },
  "cursor": {
    "theme": "Huacat Pink Theme"
  },
  "wallpaper": "sakura.png"
}
